<?xml version="1.0" encoding="UTF-8"?>
<dataroot xmlns:od="urn:schemas-microsoft-com:officedata" xmlns:xsi="http://www.w3.org/2001/XMLSchema-instance"  xsi:noNamespaceSchemaLocation="RESULTS.xsd" generated="2020-05-17T12:47:19">
<RESULTS>
<Code>1341</Code>
<SubjCode>2</SubjCode>
<Mark>78</Mark>
<Term>3</Term>
</RESULTS>
<RESULTS>
<Code>1341</Code>
<SubjCode>3</SubjCode>
<Mark>34</Mark>
<Term>3</Term>
</RESULTS>
<RESULTS>
<Code>429</Code>
<SubjCode>4</SubjCode>
<Mark>55</Mark>
<Term>2</Term>
</RESULTS>
<RESULTS>
<Code>881</Code>
<SubjCode>5</SubjCode>
<Mark>80</Mark>
<Term>3</Term>
</RESULTS>
<RESULTS>
<Code>881</Code>
<SubjCode>6</SubjCode>
<Mark>55</Mark>
<Term>3</Term>
</RESULTS>
<RESULTS>
<Code>881</Code>
<SubjCode>7</SubjCode>
<Mark>92</Mark>
<Term>3</Term>
</RESULTS>
<RESULTS>
<Code>881</Code>
<SubjCode>8</SubjCode>
<Mark>43</Mark>
<Term>2</Term>
</RESULTS>
<RESULTS>
<Code>82</Code>
<SubjCode>9</SubjCode>
<Mark>23</Mark>
<Term>2</Term>
</RESULTS>
<RESULTS>
<Code>82</Code>
<SubjCode>10</SubjCode>
<Mark>55</Mark>
<Term>2</Term>
</RESULTS>
<RESULTS>
<Code>82</Code>
<SubjCode>11</SubjCode>
<Mark>98</Mark>
<Term>3</Term>
</RESULTS>
<RESULTS>
<Code>82</Code>
<SubjCode>12</SubjCode>
<Mark>45</Mark>
<Term>3</Term>
</RESULTS>
<RESULTS>
<Code>82</Code>
<SubjCode>13</SubjCode>
<Mark>67</Mark>
<Term>2</Term>
</RESULTS>
<RESULTS>
<Code>412</Code>
<SubjCode>14</SubjCode>
<Mark>65</Mark>
<Term>2</Term>
</RESULTS>
<RESULTS>
<Code>412</Code>
<SubjCode>15</SubjCode>
<Mark>44</Mark>
<Term>3</Term>
</RESULTS>
<RESULTS>
<Code>412</Code>
<SubjCode>16</SubjCode>
<Mark>76</Mark>
<Term>3</Term>
</RESULTS>
<RESULTS>
<Code>412</Code>
<SubjCode>17</SubjCode>
<Mark>54</Mark>
<Term>3</Term>
</RESULTS>
</dataroot>
